{
  "brand": "Spider Farmer",
  "series": "1680D",
  "model": "240x120x200",
  "status": "active",
  "tent_type": "standard",
  "tent_role": "primary_grow_tent",
  "width_cm": 240,
  "depth_cm": 120,
  "height_cm": 200,
  "area_m2": 2.88,
  "volume_m3": 5.76,
  "fabric_thickness_d": 1680,
  "reflective_material": "mylar",
  "reflectivity_percent": 100,
  "frame_material": "steel",
  "pole_diameter_mm": 16,
  "max_load_kg": null,
  "door_count": null,
  "viewing_window": true,
  "floor_tray_included": true,
  "duct_ports_count": null,
  "duct_port_sizes_mm": null,
  "cable_ports_count": null,
  "recommended_exhaust_airflow_m3_h_min": null,
  "recommended_exhaust_airflow_m3_h_max": null,
  "recommended_light_power_w_min": 730,
  "recommended_light_power_w_max": 900,
  "include_in_default_tent_calculator": true,
  "source_url": "https://www.amazon.de/dp/B09QBR4B98",
  "source_type": "retailer",
  "source_date": "2026-06-27",
  "confidence_level": "B",
  "uvp_amount": 329.99,
  "uvp_currency": "EUR",
  "notes": "Standalone tent w/ window+base tray, 1680D, steel, 100% mylar (growers-point.de). UVP 329.99 / 309.99EUR. Rec 2x SF4000/SE7000/G8600 + 8in exhaust."
}