{
  "brand": "Mammoth",
  "series": "Pro+",
  "model": "Pro+ 100 (100x100x200)",
  "status": "active",
  "tent_type": "standard",
  "tent_role": "primary_grow_tent",
  "width_cm": 100,
  "depth_cm": 100,
  "height_cm": 200,
  "area_m2": 1.0,
  "volume_m3": 2.0,
  "fabric_thickness_d": 600,
  "reflective_material": "mylar",
  "reflectivity_percent": 95,
  "frame_material": "steel",
  "pole_diameter_mm": 22,
  "max_load_kg": null,
  "door_count": 1,
  "viewing_window": true,
  "floor_tray_included": true,
  "duct_ports_count": null,
  "duct_port_sizes_mm": 203,
  "cable_ports_count": 2,
  "recommended_exhaust_airflow_m3_h_min": null,
  "recommended_exhaust_airflow_m3_h_max": null,
  "recommended_light_power_w_min": 400,
  "recommended_light_power_w_max": 600,
  "include_in_default_tent_calculator": true,
  "source_url": "https://www.led-grower.eu/mammoth-pro--100-100x100x200cm/",
  "source_type": "retailer",
  "source_date": "2026-06-27",
  "confidence_level": "C",
  "uvp_amount": 132,
  "uvp_currency": "EUR",
  "notes": "led-grower.eu: 600D mylar 95%, 22mm steel poles, 1 door, 2x300x200 windows, 203mm in/out (count ambiguous), 2x76mm cable, removable floor. Rec 1x400-600W HID."
}