{
  "brand": "Spider Farmer",
  "series": "Propagation",
  "model": "60x40x50 Propagation Tent",
  "status": "active",
  "tent_type": "propagation",
  "tent_role": "propagation_tent",
  "width_cm": 60,
  "depth_cm": 40,
  "height_cm": 50,
  "area_m2": 0.24,
  "volume_m3": 0.12,
  "fabric_thickness_d": 2000,
  "reflective_material": "mylar",
  "reflectivity_percent": null,
  "frame_material": "metal",
  "pole_diameter_mm": null,
  "max_load_kg": null,
  "door_count": 1,
  "viewing_window": null,
  "floor_tray_included": true,
  "duct_ports_count": null,
  "duct_port_sizes_mm": null,
  "cable_ports_count": null,
  "recommended_exhaust_airflow_m3_h_min": null,
  "recommended_exhaust_airflow_m3_h_max": null,
  "recommended_light_power_w_min": null,
  "recommended_light_power_w_max": null,
  "include_in_default_tent_calculator": false,
  "source_url": "https://www.amazon.de/Spider-Farmer-60x40x50-Hydroponisches-Hydroponik-Innenanbau/dp/B0DPYWXG32",
  "source_type": "marketplace",
  "source_date": "2026-06-27",
  "confidence_level": "B",
  "uvp_amount": null,
  "uvp_currency": null,
  "notes": "Amazon.de/spiderfarmer.eu: standalone 60x40x50 mini propagation tent, 2000D Oxford, roll-up door, removable base sheet, metal poles. Seedling/clone -> calc:no."
}