{
  "brand": "Secret Jardin",
  "series": "Dark Room (DR)",
  "model": "Dark Room DR150",
  "status": "active",
  "tent_type": "standard",
  "tent_role": "primary_grow_tent",
  "width_cm": 150,
  "depth_cm": 150,
  "height_cm": 217,
  "area_m2": 2.25,
  "volume_m3": 4.8825,
  "fabric_thickness_d": 400,
  "reflective_material": "mylar",
  "reflectivity_percent": null,
  "frame_material": "steel",
  "pole_diameter_mm": 25,
  "max_load_kg": 75,
  "door_count": 2,
  "viewing_window": false,
  "floor_tray_included": true,
  "duct_ports_count": 2,
  "duct_port_sizes_mm": 200,
  "cable_ports_count": 2,
  "recommended_exhaust_airflow_m3_h_min": 350,
  "recommended_exhaust_airflow_m3_h_max": 650,
  "recommended_light_power_w_min": 400,
  "recommended_light_power_w_max": 600,
  "include_in_default_tent_calculator": true,
  "source_url": "https://www.secretjardin.com/wp-content/uploads/2022/09/20220922-DARK-ROOM-DATASHEET.pdf",
  "source_type": "manufacturer_pdf",
  "source_date": "2026-06-27",
  "confidence_level": "A",
  "uvp_amount": 389.9,
  "uvp_currency": "EUR",
  "notes": "R4.00 datasheet: M400D mylar, Ø25mm #201 stainless poles, fibered water tray, 2x DF25 Ø254 (200 conn) duct, 2x CF7 cable, 75kg/tent, L3 600W, 650 m3/h. UVP €389.90 growmart.eu. No standalone R4 Amazon.de"
}