{
  "brand": "HOMEbox",
  "series": "Ambient Q-series",
  "model": "Ambient Q150+",
  "status": "active",
  "tent_type": "standard",
  "tent_role": "primary_grow_tent",
  "width_cm": 150,
  "depth_cm": 150,
  "height_cm": 220,
  "area_m2": 2.25,
  "volume_m3": 4.95,
  "fabric_thickness_d": null,
  "reflective_material": "PAR+",
  "reflectivity_percent": null,
  "frame_material": "metal",
  "pole_diameter_mm": 22,
  "max_load_kg": 75,
  "door_count": null,
  "viewing_window": true,
  "floor_tray_included": true,
  "duct_ports_count": null,
  "duct_port_sizes_mm": null,
  "cable_ports_count": null,
  "recommended_exhaust_airflow_m3_h_min": null,
  "recommended_exhaust_airflow_m3_h_max": null,
  "recommended_light_power_w_min": null,
  "recommended_light_power_w_max": null,
  "include_in_default_tent_calculator": true,
  "source_url": "https://www.growmart.eu/Homebox-Q150-Ambient-150x150x220-cm",
  "source_type": "retailer",
  "source_date": "2026-06-27",
  "confidence_level": "B",
  "uvp_amount": 379,
  "uvp_currency": "EUR",
  "notes": "2.25m2, PAR+ lining, 22mm frame (series), 75kg, Total-Blackout zips, OmniFlow vents. growmart.eu/greenhope.de. ASIN=official Homebox standalone tent."
}