{
  "brand": "HOMEbox",
  "series": "Ambient Q-series",
  "model": "Ambient Q60+",
  "status": "active",
  "tent_type": "standard",
  "tent_role": "primary_grow_tent",
  "width_cm": 60,
  "depth_cm": 60,
  "height_cm": 160,
  "area_m2": 0.36,
  "volume_m3": 0.576,
  "fabric_thickness_d": null,
  "reflective_material": "PAR+",
  "reflectivity_percent": null,
  "frame_material": "metal",
  "pole_diameter_mm": null,
  "max_load_kg": 50,
  "door_count": 1,
  "viewing_window": false,
  "floor_tray_included": true,
  "duct_ports_count": 3,
  "duct_port_sizes_mm": "100,125,160",
  "cable_ports_count": 1,
  "recommended_exhaust_airflow_m3_h_min": null,
  "recommended_exhaust_airflow_m3_h_max": null,
  "recommended_light_power_w_min": null,
  "recommended_light_power_w_max": null,
  "include_in_default_tent_calculator": true,
  "source_url": "https://growshop.net/en/grow-tents/grow-tent-homebox-ambient-q60-60x60x160",
  "source_type": "retailer",
  "source_date": "2026-06-27",
  "confidence_level": "B",
  "uvp_amount": 89.9,
  "uvp_currency": "EUR",
  "notes": "PAR+ lining, metal frame, max 50kg, ports 100mm back/125mm side/160mm roof +2x125 OmniFlow, cable port. ~89.90EUR growmart. Standalone tent ASIN."
}