{
  "brand": "Secret Jardin",
  "series": "Dark Room (DR)",
  "model": "Dark Room DR60",
  "status": "active",
  "tent_type": "standard",
  "tent_role": "primary_grow_tent",
  "width_cm": 60,
  "depth_cm": 60,
  "height_cm": 170,
  "area_m2": 0.36,
  "volume_m3": 0.612,
  "fabric_thickness_d": 210,
  "reflective_material": "mylar",
  "reflectivity_percent": 95,
  "frame_material": "steel",
  "pole_diameter_mm": 19,
  "max_load_kg": 30,
  "door_count": 1,
  "viewing_window": true,
  "floor_tray_included": false,
  "duct_ports_count": 3,
  "duct_port_sizes_mm": 180,
  "cable_ports_count": 3,
  "recommended_exhaust_airflow_m3_h_min": null,
  "recommended_exhaust_airflow_m3_h_max": null,
  "recommended_light_power_w_min": 150,
  "recommended_light_power_w_max": 250,
  "include_in_default_tent_calculator": true,
  "source_url": "https://www.hydroponics.eu/dark-room-dr60-60x60x170-secret-jardin-rev-3-0~9082.html",
  "source_type": "retailer",
  "source_date": "2026-06-27",
  "confidence_level": "B",
  "uvp_amount": 149.9,
  "uvp_currency": "EUR",
  "notes": "R3.0 V3.0; 210D mylar 95% hammered, Ø19mm steel, 3x Ø180 duct, 3x Ø75 cable, 2 windows 30x20, 30kg, light 150W LED/250W HPS. UVP growheads.de; standalone Amazon.de"
}