{
  "brand": "Garden HighPro",
  "series": "ProBox Propagator",
  "model": "ProBox Propagator M (80x60x40)",
  "status": "active",
  "tent_type": "propagation",
  "tent_role": "propagation_tent",
  "width_cm": 80,
  "depth_cm": 60,
  "height_cm": 40,
  "area_m2": 0.48,
  "volume_m3": 0.192,
  "fabric_thickness_d": 420,
  "reflective_material": "mylar",
  "reflectivity_percent": 97,
  "frame_material": "metal",
  "pole_diameter_mm": null,
  "max_load_kg": 36,
  "door_count": 1,
  "viewing_window": true,
  "floor_tray_included": null,
  "duct_ports_count": null,
  "duct_port_sizes_mm": null,
  "cable_ports_count": null,
  "recommended_exhaust_airflow_m3_h_min": null,
  "recommended_exhaust_airflow_m3_h_max": null,
  "recommended_light_power_w_min": null,
  "recommended_light_power_w_max": null,
  "include_in_default_tent_calculator": false,
  "source_url": "https://www.higarden.eu/garden-highpro-probox-grow-tents/",
  "source_type": "retailer",
  "source_date": "2026-06-27",
  "confidence_level": "B",
  "uvp_amount": 92.55,
  "uvp_currency": "EUR",
  "notes": "Propagation tent. 420D nylon, 97% mylar series spec (gardenhighpro/higarden). UVP higarden. ASIN B07JX87QGV standalone tent amazon.de (Propagator M 80x60x40)."
}