{
  "brand": "DiamondBox",
  "series": "Silver Line",
  "model": "SL120E 240x120x200",
  "status": "active",
  "tent_type": "standard",
  "tent_role": "primary_grow_tent",
  "width_cm": 240,
  "depth_cm": 120,
  "height_cm": 200,
  "area_m2": 2.88,
  "volume_m3": 5.76,
  "fabric_thickness_d": null,
  "reflective_material": "mylar",
  "reflectivity_percent": null,
  "frame_material": "steel",
  "pole_diameter_mm": 16,
  "max_load_kg": null,
  "door_count": 2,
  "viewing_window": true,
  "floor_tray_included": true,
  "duct_ports_count": null,
  "duct_port_sizes_mm": null,
  "cable_ports_count": null,
  "recommended_exhaust_airflow_m3_h_min": null,
  "recommended_exhaust_airflow_m3_h_max": null,
  "recommended_light_power_w_min": null,
  "recommended_light_power_w_max": null,
  "include_in_default_tent_calculator": true,
  "source_url": "https://wondergrow.de/en/products/diamondbox-silver-line-sl120e-120x240x200cm",
  "source_type": "retailer",
  "source_date": "2026-06-27",
  "confidence_level": "C",
  "uvp_amount": 249.95,
  "uvp_currency": "EUR",
  "notes": "Wide 240x120x200 single chamber, 2.88m2, double doors/two-side access, silver Mylar, 16mm steel frame, waterproof tray (wondergrow.de). Retail varies ~220-290 EUR. No standalone Amazon.de ASIN found."
}