{
  "brand": "HOMEbox",
  "series": "Ambient Triangle",
  "model": "Vista Triangle+ 120x85x200",
  "status": "active",
  "tent_type": "standard",
  "tent_role": "primary_grow_tent",
  "width_cm": 120,
  "depth_cm": 85,
  "height_cm": 200,
  "area_m2": 1.02,
  "volume_m3": 2.04,
  "fabric_thickness_d": null,
  "reflective_material": "PAR+",
  "reflectivity_percent": null,
  "frame_material": "steel",
  "pole_diameter_mm": 22,
  "max_load_kg": 40,
  "door_count": 1,
  "viewing_window": true,
  "floor_tray_included": true,
  "duct_ports_count": 3,
  "duct_port_sizes_mm": "100,160",
  "cable_ports_count": null,
  "recommended_exhaust_airflow_m3_h_min": null,
  "recommended_exhaust_airflow_m3_h_max": null,
  "recommended_light_power_w_min": 250,
  "recommended_light_power_w_max": 250,
  "include_in_default_tent_calculator": true,
  "source_url": "https://www.growshopcz.com/homebox-vista-triangle-120x85x200cm-p21102/",
  "source_type": "retailer",
  "source_date": "2026-06-27",
  "confidence_level": "B",
  "uvp_amount": 199,
  "uvp_currency": "EUR",
  "notes": "growshopcz.com: 0.9m2, window, removable floor, 40kg, PAR+, 250W rec; ceiling 160mm+100mm walls+4x100 OmniFlow. EU retail ~EUR177-219; no verified .de bare-tent ASIN."
}