{
  "brand": "Mammoth",
  "series": "Pro+",
  "model": "Pro+ 150 (150x150x200)",
  "status": "active",
  "tent_type": "standard",
  "tent_role": "primary_grow_tent",
  "width_cm": 150,
  "depth_cm": 150,
  "height_cm": 200,
  "area_m2": 2.25,
  "volume_m3": 4.5,
  "fabric_thickness_d": 600,
  "reflective_material": "mylar",
  "reflectivity_percent": 95,
  "frame_material": "steel",
  "pole_diameter_mm": 22,
  "max_load_kg": null,
  "door_count": 1,
  "viewing_window": true,
  "floor_tray_included": true,
  "duct_ports_count": 5,
  "duct_port_sizes_mm": 203,
  "cable_ports_count": 2,
  "recommended_exhaust_airflow_m3_h_min": null,
  "recommended_exhaust_airflow_m3_h_max": null,
  "recommended_light_power_w_min": null,
  "recommended_light_power_w_max": 1000,
  "include_in_default_tent_calculator": true,
  "source_url": "https://www.led-grower.eu/mammoth-pro--150-150x150x200cm/",
  "source_type": "retailer",
  "source_date": "2026-06-27",
  "confidence_level": "B",
  "uvp_amount": 165,
  "uvp_currency": "EUR",
  "notes": "led-grower.eu: 600D mylar 95%, 22mm steel poles, 1 door, 2x300x200 windows, 2x203 in/3x203 out, 2x76mm cable, removable floor. UVP ~165EUR excl VAT. Rec 1x1000W HID."
}