{
  "brand": "BudBox",
  "series": "PRO",
  "model": "BudBox PRO L 100x100x200",
  "status": "active",
  "tent_type": "standard",
  "tent_role": "primary_grow_tent",
  "width_cm": 100,
  "depth_cm": 100,
  "height_cm": 200,
  "area_m2": 1.0,
  "volume_m3": 2.0,
  "fabric_thickness_d": 600,
  "reflective_material": "mylar",
  "reflectivity_percent": null,
  "frame_material": "steel",
  "pole_diameter_mm": 16,
  "max_load_kg": null,
  "door_count": 1,
  "viewing_window": true,
  "floor_tray_included": true,
  "duct_ports_count": 4,
  "duct_port_sizes_mm": "150,175",
  "cable_ports_count": 2,
  "recommended_exhaust_airflow_m3_h_min": null,
  "recommended_exhaust_airflow_m3_h_max": null,
  "recommended_light_power_w_min": null,
  "recommended_light_power_w_max": null,
  "include_in_default_tent_calculator": true,
  "source_url": "https://www.higarden.eu/budbox-silver/budbox-pro-l200-100x100x200cm-silver/",
  "source_type": "retailer",
  "source_date": "2026-06-27",
  "confidence_level": "B",
  "uvp_amount": 184.76,
  "uvp_currency": "EUR",
  "notes": "higarden.eu silver EUR184.76 (white EUR224.90). 16mm steel, green window, drip tray, 2x175 + 2x150 vents + 2x100 cable. PRO 600D silver. Also L180=100x100x180"
}