{
  "brand": "BudBox",
  "series": "PRO Titan",
  "model": "BudBox PRO Titan 9 900x450x240",
  "status": "active",
  "tent_type": "standard",
  "tent_role": "primary_grow_tent",
  "width_cm": 900,
  "depth_cm": 450,
  "height_cm": 240,
  "area_m2": 40.5,
  "volume_m3": 97.2,
  "fabric_thickness_d": 600,
  "reflective_material": "mylar",
  "reflectivity_percent": null,
  "frame_material": "steel",
  "pole_diameter_mm": 25,
  "max_load_kg": null,
  "door_count": 8,
  "viewing_window": true,
  "floor_tray_included": true,
  "duct_ports_count": 22,
  "duct_port_sizes_mm": "275,340",
  "cable_ports_count": 5,
  "recommended_exhaust_airflow_m3_h_min": null,
  "recommended_exhaust_airflow_m3_h_max": null,
  "recommended_light_power_w_min": null,
  "recommended_light_power_w_max": null,
  "include_in_default_tent_calculator": true,
  "source_url": "https://www.thegrowsuperstore.com/products/budbox-pro-titan-9-900-450-240-grow-tent",
  "source_type": "retailer",
  "source_date": "2026-06-27",
  "confidence_level": "B",
  "uvp_amount": null,
  "uvp_currency": null,
  "notes": "PRO 600D mylar/white; 25mm steel; 5 night-vision windows; 12x275+10x340 ports,5x102 cable,6 irrigation,8 doors; ~280kg listed weight. thegrowsuperstore.com"
}