{
  "brand": "Green Qube",
  "series": "Green-Qube (GQ)",
  "model": "GQ1020L",
  "status": "active",
  "tent_type": "standard",
  "tent_role": "primary_grow_tent",
  "width_cm": 100,
  "depth_cm": 200,
  "height_cm": 220,
  "area_m2": 2.0,
  "volume_m3": 4.4,
  "fabric_thickness_d": 600,
  "reflective_material": "diamond_mylar",
  "reflectivity_percent": 98,
  "frame_material": "steel",
  "pole_diameter_mm": 25,
  "max_load_kg": 100,
  "door_count": 5,
  "viewing_window": true,
  "floor_tray_included": true,
  "duct_ports_count": 5,
  "duct_port_sizes_mm": 280,
  "cable_ports_count": 4,
  "recommended_exhaust_airflow_m3_h_min": null,
  "recommended_exhaust_airflow_m3_h_max": null,
  "recommended_light_power_w_min": null,
  "recommended_light_power_w_max": null,
  "include_in_default_tent_calculator": true,
  "source_url": "https://www.green-qube.com/product/green-qube-v-1020-grow-tent-1m-x-2m-x-2m/",
  "source_type": "manufacturer",
  "source_date": "2026-06-27",
  "confidence_level": "B",
  "uvp_amount": null,
  "uvp_currency": null,
  "notes": "green-qube.com GQ1020 1x2x2.2m: 600D PVA, diamond mylar 98%, 25x1mm steel poles >100kg, 2 main+1 side+2 rear doors, 5x11in socks+4 cable, Sensor Window, spill tray"
}