{
  "brand": "Garden HighPro",
  "series": "ProBox Master",
  "model": "ProBox Master 240L (240x120x200)",
  "status": "active",
  "tent_type": "standard",
  "tent_role": "primary_grow_tent",
  "width_cm": 240,
  "depth_cm": 120,
  "height_cm": 200,
  "area_m2": 2.88,
  "volume_m3": 5.76,
  "fabric_thickness_d": 600,
  "reflective_material": "mylar",
  "reflectivity_percent": 97,
  "frame_material": "metal",
  "pole_diameter_mm": null,
  "max_load_kg": 72,
  "door_count": null,
  "viewing_window": null,
  "floor_tray_included": true,
  "duct_ports_count": null,
  "duct_port_sizes_mm": null,
  "cable_ports_count": null,
  "recommended_exhaust_airflow_m3_h_min": null,
  "recommended_exhaust_airflow_m3_h_max": null,
  "recommended_light_power_w_min": null,
  "recommended_light_power_w_max": null,
  "include_in_default_tent_calculator": true,
  "source_url": "https://www.eugardencenter.com/en/garden-highpro-probox-master-grow-tent.html",
  "source_type": "retailer",
  "source_date": "2026-06-27",
  "confidence_level": "C",
  "uvp_amount": 253.5,
  "uvp_currency": "EUR",
  "notes": "Rectangular long format. Series: 600D nylon, 97% mylar, metal frame, up to 72kg. eugardencenter.com/alchimiaweb.com"
}