{
  "brand": "HOMEbox",
  "series": "Ambient Q-series",
  "model": "Ambient Q200+",
  "status": "active",
  "tent_type": "standard",
  "tent_role": "primary_grow_tent",
  "width_cm": 200,
  "depth_cm": 200,
  "height_cm": 220,
  "area_m2": 4.0,
  "volume_m3": 8.8,
  "fabric_thickness_d": null,
  "reflective_material": "PAR+",
  "reflectivity_percent": null,
  "frame_material": "metal",
  "pole_diameter_mm": 22,
  "max_load_kg": null,
  "door_count": null,
  "viewing_window": true,
  "floor_tray_included": true,
  "duct_ports_count": null,
  "duct_port_sizes_mm": null,
  "cable_ports_count": null,
  "recommended_exhaust_airflow_m3_h_min": null,
  "recommended_exhaust_airflow_m3_h_max": null,
  "recommended_light_power_w_min": null,
  "recommended_light_power_w_max": null,
  "include_in_default_tent_calculator": true,
  "source_url": "https://www.growmart.eu/Homebox-Q200-Ambient-200x200x220cm_1",
  "source_type": "retailer",
  "source_date": "2026-06-27",
  "confidence_level": "B",
  "uvp_amount": 599.9,
  "uvp_currency": "EUR",
  "notes": "4m2, PAR+ lining, 22mm frame, 6 OmniFlow vents, ground-level side windows. growmart.eu/grow-guru.com. ASIN=Weedness-listed standalone tent (220cm = + version)."
}