{
  "brand": "Mars Hydro",
  "series": "1680D Grow Tent",
  "model": "120x120x200cm (4'x4', 48\"x48\"x80\")",
  "status": "active",
  "tent_type": "standard",
  "tent_role": "primary_grow_tent",
  "width_cm": 120,
  "depth_cm": 120,
  "height_cm": 200,
  "area_m2": 1.44,
  "volume_m3": 2.88,
  "fabric_thickness_d": 1680,
  "reflective_material": "mylar",
  "reflectivity_percent": 95,
  "frame_material": "steel",
  "pole_diameter_mm": 16,
  "max_load_kg": null,
  "door_count": null,
  "viewing_window": true,
  "floor_tray_included": true,
  "duct_ports_count": null,
  "duct_port_sizes_mm": null,
  "cable_ports_count": null,
  "recommended_exhaust_airflow_m3_h_min": null,
  "recommended_exhaust_airflow_m3_h_max": null,
  "recommended_light_power_w_min": 450,
  "recommended_light_power_w_max": 480,
  "include_in_default_tent_calculator": true,
  "source_url": "https://marshydro.eu/products/120x120x200cm-indoor-grow-tent/",
  "source_type": "manufacturer",
  "source_date": "2026-06-27",
  "confidence_level": "B",
  "uvp_amount": 129.99,
  "uvp_currency": "EUR",
  "notes": "marshydro.eu: 1680D Oxford, 95% mylar, 16mm steel push-lock frame, viewing window, tray. Amazon.de B07XCMVKYL standalone 120x120x200 tent (no light/fan). Light W from MH-rec TS3000/FC4800."
}