{
  "brand": "GrowPRO",
  "series": "GrowPRO 3.0",
  "model": "GrowPRO 3.0 Growbox XXS 40x40x120",
  "status": "discontinued",
  "tent_type": "standard",
  "tent_role": "primary_grow_tent",
  "width_cm": 40,
  "depth_cm": 40,
  "height_cm": 120,
  "area_m2": 0.16,
  "volume_m3": 0.192,
  "fabric_thickness_d": 600,
  "reflective_material": "other",
  "reflectivity_percent": 98,
  "frame_material": "metal",
  "pole_diameter_mm": 16,
  "max_load_kg": null,
  "door_count": 1,
  "viewing_window": null,
  "floor_tray_included": true,
  "duct_ports_count": null,
  "duct_port_sizes_mm": null,
  "cable_ports_count": null,
  "recommended_exhaust_airflow_m3_h_min": null,
  "recommended_exhaust_airflow_m3_h_max": null,
  "recommended_light_power_w_min": null,
  "recommended_light_power_w_max": null,
  "include_in_default_tent_calculator": true,
  "source_url": "https://www.growmart.eu/GrowPRO-30-Grow-Tent-XXS-40x40x120cm",
  "source_type": "retailer",
  "source_date": "2026-06-27",
  "confidence_level": "C",
  "uvp_amount": 99,
  "uvp_currency": "EUR",
  "notes": "Discontinued 3.0. Series specs (600D Oxford, white PE ~98% PAR/Mylar, 16mm poles, removable floor) per growmart.eu. UVP 99 EUR growmart. Amazon.de B08WHM38FG standalone 3.0 XXS tent."
}