{
  "brand": "DiamondBox",
  "series": "Silver Line",
  "model": "SL60 60x60x160",
  "status": "active",
  "tent_type": "standard",
  "tent_role": "primary_grow_tent",
  "width_cm": 60,
  "depth_cm": 60,
  "height_cm": 160,
  "area_m2": 0.36,
  "volume_m3": 0.576,
  "fabric_thickness_d": null,
  "reflective_material": "mylar",
  "reflectivity_percent": null,
  "frame_material": "steel",
  "pole_diameter_mm": 16,
  "max_load_kg": 10,
  "door_count": null,
  "viewing_window": false,
  "floor_tray_included": true,
  "duct_ports_count": 3,
  "duct_port_sizes_mm": "200,160,80",
  "cable_ports_count": null,
  "recommended_exhaust_airflow_m3_h_min": null,
  "recommended_exhaust_airflow_m3_h_max": null,
  "recommended_light_power_w_min": null,
  "recommended_light_power_w_max": null,
  "include_in_default_tent_calculator": true,
  "source_url": "https://gogrow.de/products/diamondbox-silver-line-sl60",
  "source_type": "retailer",
  "source_date": "2026-06-27",
  "confidence_level": "B",
  "uvp_amount": 79.9,
  "uvp_currency": "EUR",
  "notes": "16mm steel, 10kg, mylar, waterproof tray; ports 200mm top/160mm right/80mm back + mesh 40x20cm; no window (gogrow). Retail ~69.90-79.90."
}