{
  "brand": "BudBox",
  "series": "PRO Titan",
  "model": "BudBox PRO Titan 2 360x240x200",
  "status": "active",
  "tent_type": "standard",
  "tent_role": "primary_grow_tent",
  "width_cm": 360,
  "depth_cm": 240,
  "height_cm": 200,
  "area_m2": 8.64,
  "volume_m3": 17.28,
  "fabric_thickness_d": 600,
  "reflective_material": "mylar",
  "reflectivity_percent": null,
  "frame_material": "steel",
  "pole_diameter_mm": 25,
  "max_load_kg": null,
  "door_count": 6,
  "viewing_window": true,
  "floor_tray_included": true,
  "duct_ports_count": 14,
  "duct_port_sizes_mm": "275,340",
  "cable_ports_count": 4,
  "recommended_exhaust_airflow_m3_h_min": null,
  "recommended_exhaust_airflow_m3_h_max": null,
  "recommended_light_power_w_min": null,
  "recommended_light_power_w_max": null,
  "include_in_default_tent_calculator": true,
  "source_url": "https://www.ledgrowshop.eu/budbox-tents/budbox-pro-titan-ii-360x240x200-white/",
  "source_type": "retailer",
  "source_date": "2026-06-27",
  "confidence_level": "B",
  "uvp_amount": 1062.81,
  "uvp_currency": "EUR",
  "notes": "PRO Titan II: 25mm steel, no floor poles. 6x340+8x275 duct, 4x100 cable, 2 front+4 lateral doors, green window (ledgrowshop.eu). EUR white price ledgrowshop.eu."
}