{
  "brand": "Secret Jardin",
  "series": "Dark Propagator (DP)",
  "model": "Dark Propagator DP120",
  "status": "active",
  "tent_type": "propagation",
  "tent_role": "propagation_tent",
  "width_cm": 120,
  "depth_cm": 60,
  "height_cm": 190,
  "area_m2": 0.72,
  "volume_m3": 1.368,
  "fabric_thickness_d": 210,
  "reflective_material": "mylar",
  "reflectivity_percent": null,
  "frame_material": "steel",
  "pole_diameter_mm": 16,
  "max_load_kg": 50,
  "door_count": null,
  "viewing_window": false,
  "floor_tray_included": true,
  "duct_ports_count": 2,
  "duct_port_sizes_mm": 100,
  "cable_ports_count": 2,
  "recommended_exhaust_airflow_m3_h_min": 50,
  "recommended_exhaust_airflow_m3_h_max": 150,
  "recommended_light_power_w_min": 40,
  "recommended_light_power_w_max": 80,
  "include_in_default_tent_calculator": false,
  "source_url": "https://www.secretjardin.com/wp-content/uploads/2022/09/20220922-DARK-PROPAGATOR-DATASHEET.pdf",
  "source_type": "manufacturer_pdf",
  "source_date": "2026-06-27",
  "confidence_level": "A",
  "uvp_amount": 349.9,
  "uvp_currency": "EUR",
  "notes": "SJ DP datasheet: DP120 120x60x192 assembled (sold as 190) R4.0, M210D Mylar, PE600D/210D, 16mm steel, 2x DF16 (Ø100), water tray, up to 5 shelf levels. Price greenweedshop.de"
}