{
  "brand": "Garden HighPro",
  "series": "ProBox Basic",
  "model": "ProBox Basic 150 (150x150x200)",
  "status": "active",
  "tent_type": "standard",
  "tent_role": "primary_grow_tent",
  "width_cm": 150,
  "depth_cm": 150,
  "height_cm": 200,
  "area_m2": 2.25,
  "volume_m3": 4.5,
  "fabric_thickness_d": 420,
  "reflective_material": "mylar",
  "reflectivity_percent": 97,
  "frame_material": "metal",
  "pole_diameter_mm": 16,
  "max_load_kg": 28,
  "door_count": 1,
  "viewing_window": true,
  "floor_tray_included": null,
  "duct_ports_count": null,
  "duct_port_sizes_mm": null,
  "cable_ports_count": null,
  "recommended_exhaust_airflow_m3_h_min": null,
  "recommended_exhaust_airflow_m3_h_max": null,
  "recommended_light_power_w_min": null,
  "recommended_light_power_w_max": null,
  "include_in_default_tent_calculator": true,
  "source_url": "https://www.eugardencenter.com/en/garden-highpro-probox-basic-grow-tent.html",
  "source_type": "retailer",
  "source_date": "2026-06-27",
  "confidence_level": "B",
  "uvp_amount": 162.55,
  "uvp_currency": "EUR",
  "notes": "420D nylon, 97% mylar, 28kg max load (stated for 150). No standalone-tent amazon.de ASIN found. UVP eugardencenter.com"
}