{
  "brand": "GrowPRO",
  "series": "GrowPRO 4.0",
  "model": "GrowPRO 4.0 Growbox XS-E 120x60x200",
  "status": "active",
  "tent_type": "standard",
  "tent_role": "primary_grow_tent",
  "width_cm": 120,
  "depth_cm": 60,
  "height_cm": 200,
  "area_m2": 0.72,
  "volume_m3": 1.44,
  "fabric_thickness_d": 600,
  "reflective_material": "other",
  "reflectivity_percent": 98,
  "frame_material": "metal",
  "pole_diameter_mm": 16,
  "max_load_kg": 40,
  "door_count": 1,
  "viewing_window": null,
  "floor_tray_included": true,
  "duct_ports_count": null,
  "duct_port_sizes_mm": null,
  "cable_ports_count": null,
  "recommended_exhaust_airflow_m3_h_min": null,
  "recommended_exhaust_airflow_m3_h_max": null,
  "recommended_light_power_w_min": null,
  "recommended_light_power_w_max": 340,
  "include_in_default_tent_calculator": true,
  "source_url": "https://www.growmart.eu/GrowPRO-40-Growbox-XS-E-120x60x200cm-Beige-or-Chive",
  "source_type": "manufacturer",
  "source_date": "2026-06-27",
  "confidence_level": "B",
  "uvp_amount": 109.9,
  "uvp_currency": "EUR",
  "notes": "growmart.eu: narrow 0.72sqm, 3-layer 600D Oxford, diffuse reflection, zip-off double floor. 16mm/98%/40kg applied as series values (not on page). Rec. SANlight EVO 5-100 340W. List 109.90 EUR (98.91 sale)."
}